{
  "schema": 1,
  "kind": "kapitsa-bench",
  "mode": "full",
  "time_utc": "2026-10-23T09:17:55Z",
  "kapitsa": {
    "version": "0.2.11",
    "commit": "6f9e7b4"
  },
  "mac": {
    "identifier": "Mac16,11",
    "name": "Mac mini (2024)",
    "year": 2024,
    "chip": "Apple M4 Pro",
    "cpu_cores": 14,
    "gpu_cores": 20,
    "memory_gb": 64,
    "macos": "27.0.1",
    "macos_build": "26A434"
  },
  "model": {
    "name": "qwen3.8-27b",
    "title": "Qwen3.8-27B",
    "variant": "4bit",
    "precision": "4-bit",
    "catalog": true,
    "revision": "6067b15",
    "decoding": "unknown",
    "decoding_detail": "KFlash speculative decoding (DFlash2 lattice, tree verify)",
    "drafter": null
  },
  "protocol": {
    "corpus_sha256": "58a7756fd94fc48a7b7306d330b2c44663bdf22faa943f82430966c2878081b2",
    "decode_tokens": 512,
    "decode_runs": 5,
    "greedy_runs": 5,
    "sizes": [
      4000,
      16000
    ],
    "temperature": 0.6
  },
  "results": {
    "decode": {
      "median_tps": 55.04,
      "runs_tps": [
        62.6,
        53.6,
        55.04,
        59.37,
        44.55
      ]
    },
    "decode_greedy": {
      "median_tps": 58.24,
      "runs_tps": [
        58.24,
        58.28,
        57.71,
        57.93,
        59.34
      ]
    },
    "prefill": [
      {
        "size": 4000,
        "prompt_tokens": 4133,
        "ttft_s": 11.5452,
        "tps": 358.0,
        "followup_s": [
          0.2533,
          0.3114,
          0.2499
        ],
        "followup_median_s": 0.2533,
        "followup_suffix_tps": 89.9
      },
      {
        "size": 16000,
        "prompt_tokens": 16284,
        "ttft_s": 52.0136,
        "tps": 313.1,
        "followup_s": [
          0.2704,
          0.3341,
          0.2716
        ],
        "followup_median_s": 0.2716,
        "followup_suffix_tps": 83.8
      }
    ],
    "tool_calls": "pass",
    "peak_memory_gb": 19.7
  },
  "conditions": {
    "power_source": "ac",
    "power_mode": "automatic",
    "low_power_mode": false,
    "thermal_state": "fair",
    "swapouts": 0,
    "gpu_quiet_wait_s": 24.1,
    "gpu_other_mean_pct": 1.04,
    "gpu_other_max_pct": 3.71,
    "gpu_ambient_mean_pct": 0.92,
    "gpu_users": [
      "ScreensharingAgent"
    ],
    "contention": []
  },
  "flags": [],
  "invalid": []
}
