{
  "schema": 1,
  "kind": "kapitsa-bench",
  "mode": "full",
  "time_utc": "2026-10-22T09:45:40Z",
  "kapitsa": {
    "version": "0.2.6",
    "commit": "76a4970"
  },
  "mac": {
    "identifier": "Mac17,3",
    "name": "MacBook Air (13-inch, M5)",
    "year": 2026,
    "chip": "Apple M5",
    "cpu_cores": 10,
    "gpu_cores": 10,
    "memory_gb": 24,
    "macos": "26.6",
    "macos_build": "25G72"
  },
  "model": {
    "name": "qwen3.5-9b",
    "title": "Qwen3.5-9B",
    "variant": "4bit",
    "precision": "4-bit",
    "catalog": true,
    "revision": "b455506",
    "decoding": "unknown",
    "decoding_detail": "KFlash speculative decoding (DFlash2 lattice, tree verify)",
    "drafter": null
  },
  "protocol": {
    "corpus_sha256": "1a9bb103b3f6d39ee5b9f5bf7207e304c5ce92788c273685f597508c7d2bde28",
    "decode_tokens": 512,
    "decode_runs": 5,
    "greedy_runs": 5,
    "sizes": [
      4000,
      16000
    ]
  },
  "results": {
    "decode": {
      "median_tps": 63.68,
      "runs_tps": [
        84.74,
        57.28,
        63.68,
        67.05,
        60.82
      ]
    },
    "decode_greedy": {
      "median_tps": 70.93,
      "runs_tps": [
        62.09,
        68.95,
        71.97,
        71.53,
        70.93
      ]
    },
    "prefill": [
      {
        "size": 4000,
        "prompt_tokens": 4133,
        "ttft_s": 7.7346,
        "tps": 534.4,
        "followup_s": [
          0.1284,
          0.1598,
          0.1265
        ],
        "followup_median_s": 0.1284
      },
      {
        "size": 16000,
        "prompt_tokens": 16286,
        "ttft_s": 33.5605,
        "tps": 485.3,
        "followup_s": [
          0.1473,
          0.1867,
          0.1494
        ],
        "followup_median_s": 0.1494
      }
    ],
    "tool_calls": "pass",
    "peak_memory_gb": 7.96
  },
  "conditions": {
    "power_source": "battery",
    "power_mode": "automatic",
    "low_power_mode": false,
    "thermal_state": "fair",
    "swapouts": 0,
    "gpu_quiet_wait_s": 18.1,
    "gpu_other_mean_pct": 1.98,
    "gpu_other_max_pct": 57.65,
    "gpu_ambient_mean_pct": 0.36,
    "gpu_users": [
      "com.apple.WebKit.GPU"
    ],
    "contention": [
      "prefill_16000"
    ]
  },
  "flags": [
    "CONTENTION: sustained foreign GPU load > 5% in ['prefill_16000'] (mean 1.98%, top ['com.apple.WebKit.GPU'])",
    "power: on battery (a Mac on battery may run slower)"
  ],
  "invalid": []
}
