{
  "schema": 1,
  "kind": "kapitsa-bench",
  "mode": "full",
  "time_utc": "2026-10-22T07:42:21Z",
  "kapitsa": {
    "version": "0.2.6",
    "commit": "76a4970"
  },
  "mac": {
    "identifier": "MacBookPro18,3",
    "name": "MacBook Pro (14-inch, 2021)",
    "year": 2021,
    "chip": "Apple M1 Pro",
    "cpu_cores": 8,
    "gpu_cores": 14,
    "memory_gb": 16,
    "macos": "27.0.1",
    "macos_build": "26A434"
  },
  "model": {
    "name": "nemotron-nano-9b-v2",
    "title": "Nemotron Nano 9B v2",
    "variant": "nvfp4",
    "precision": "NVFP4",
    "catalog": true,
    "revision": "8556c91",
    "decoding": "plain",
    "decoding_detail": "plain decoding",
    "drafter": null
  },
  "protocol": {
    "corpus_sha256": "1a9bb103b3f6d39ee5b9f5bf7207e304c5ce92788c273685f597508c7d2bde28",
    "decode_tokens": 512,
    "decode_runs": 5,
    "greedy_runs": 5,
    "sizes": [
      4000,
      16000
    ]
  },
  "results": {
    "decode": {
      "median_tps": 24.53,
      "runs_tps": [
        24.86,
        24.31,
        24.53,
        24.15,
        24.65
      ]
    },
    "decode_greedy": {
      "median_tps": 24.81,
      "runs_tps": [
        24.7,
        24.98,
        24.84,
        24.71,
        24.81
      ]
    },
    "prefill": [
      {
        "size": 4000,
        "prompt_tokens": 4183,
        "ttft_s": 22.1837,
        "tps": 188.6,
        "followup_s": [
          0.5373,
          0.8217,
          0.5305
        ],
        "followup_median_s": 0.5373
      },
      {
        "size": 16000,
        "prompt_tokens": 16518,
        "ttft_s": 91.9037,
        "tps": 179.7,
        "followup_s": [
          0.8878,
          0.573,
          0.5727
        ],
        "followup_median_s": 0.573
      }
    ],
    "tool_calls": "pass",
    "peak_memory_gb": 7.11,
    "mapped_gb": 0.57
  },
  "conditions": {
    "power_source": "ac",
    "power_mode": "automatic",
    "low_power_mode": false,
    "thermal_state": "nominal",
    "swapouts": 0,
    "gpu_quiet_wait_s": 18.1,
    "gpu_other_mean_pct": 0.02,
    "gpu_other_max_pct": 4.19,
    "gpu_ambient_mean_pct": 0.0,
    "gpu_users": [],
    "contention": []
  },
  "flags": [],
  "invalid": []
}
