{
  "schema": 1,
  "kind": "kapitsa-bench",
  "mode": "full",
  "time_utc": "2026-11-01T19:50:55Z",
  "kapitsa": {
    "version": "0.2.25",
    "commit": "7ea4fff"
  },
  "mac": {
    "identifier": "Mac16,7",
    "name": "MacBook Pro (16-inch, 2024)",
    "year": 2024,
    "chip": "Apple M4 Pro",
    "cpu_cores": 14,
    "gpu_cores": 20,
    "memory_gb": 48,
    "macos": "27.2",
    "macos_build": "26B123"
  },
  "model": {
    "name": "qwen3.8-27b",
    "title": "Qwen3.8-27B",
    "variant": "6bit",
    "precision": "6-bit",
    "catalog": true,
    "revision": "05f38c1",
    "decoding": "KFlash",
    "decoding_detail": "KFlash speculative decoding (DFlash2 lattice, tree verify), KFlash (DFlash2)",
    "drafter": "incoai/Qwen3.8-27B-DFlash2@015e795"
  },
  "protocol": {
    "corpus_sha256": "58a7756fd94fc48a7b7306d330b2c44663bdf22faa943f82430966c2878081b2",
    "decode_tokens": 512,
    "decode_runs": 5,
    "greedy_runs": 5,
    "sizes": [
      4000,
      16000
    ],
    "temperature": 0.6
  },
  "results": {
    "decode": {
      "median_tps": 48.15,
      "runs_tps": [
        48.15,
        48.22,
        44.44,
        44.17,
        51.8
      ]
    },
    "decode_greedy": {
      "median_tps": 44.5,
      "runs_tps": [
        44.5,
        45.05,
        44.48,
        46.72,
        44.17
      ]
    },
    "prefill": [
      {
        "size": 4000,
        "prompt_tokens": 4134,
        "ttft_s": 10.7703,
        "tps": 383.8,
        "followup_s": [
          0.2543,
          0.3086,
          0.2451
        ],
        "followup_median_s": 0.2543,
        "followup_suffix_tps": 90.5
      },
      {
        "size": 16000,
        "prompt_tokens": 16285,
        "ttft_s": 48.095,
        "tps": 338.6,
        "followup_s": [
          0.2785,
          0.3433,
          0.2741
        ],
        "followup_median_s": 0.2785,
        "followup_suffix_tps": 81.6
      }
    ],
    "tool_calls": "pass",
    "peak_memory_gb": 27.15
  },
  "conditions": {
    "power_source": "ac",
    "power_mode": "automatic",
    "low_power_mode": false,
    "thermal_state": "fair",
    "swapouts": 0,
    "gpu_quiet_wait_s": 18.1,
    "gpu_other_mean_pct": 0.02,
    "gpu_other_max_pct": 1.08,
    "gpu_ambient_mean_pct": 0.25,
    "gpu_users": [],
    "contention": []
  },
  "flags": [
    "decode: repetition loop (distinct-4-gram 0.4471)"
  ],
  "invalid": []
}
