{
  "schema": 1,
  "kind": "kapitsa-bench",
  "mode": "full",
  "time_utc": "2026-10-31T16:57:59Z",
  "kapitsa": {
    "version": "0.2.25",
    "commit": "7ea4fff"
  },
  "mac": {
    "identifier": "Mac14,9",
    "name": "MacBook Pro (14-inch, 2023)",
    "year": 2023,
    "chip": "Apple M2 Pro",
    "cpu_cores": 12,
    "gpu_cores": 19,
    "memory_gb": 32,
    "macos": "26.2",
    "macos_build": "25C56"
  },
  "model": {
    "name": "clover-35b-a3b",
    "title": "Clover-35B-A3B-Preview",
    "variant": "4bit",
    "precision": "4-bit",
    "catalog": true,
    "revision": "5eb7682",
    "decoding": "KFlash",
    "decoding_detail": "KFlash speculative decoding (DFlash2 lattice, tree verify), KFlash (DFlash2)",
    "drafter": "incoai/Qwen3.6-35B-A3B-DFlash2@51ef7b6"
  },
  "protocol": {
    "corpus_sha256": "58a7756fd94fc48a7b7306d330b2c44663bdf22faa943f82430966c2878081b2",
    "decode_tokens": 512,
    "decode_runs": 5,
    "greedy_runs": 5,
    "sizes": [
      4000,
      16000
    ],
    "temperature": 0.6
  },
  "results": {
    "decode": {
      "median_tps": 61.33,
      "runs_tps": [
        63.41,
        64.26,
        61.33,
        59.77,
        61.3
      ]
    },
    "decode_greedy": {
      "median_tps": 62.82,
      "runs_tps": [
        58.33,
        63.14,
        59.55,
        64.97,
        62.82
      ]
    },
    "prefill": [
      {
        "size": 4000,
        "prompt_tokens": 4133,
        "ttft_s": 8.1876,
        "tps": 504.8,
        "followup_s": [
          0.142,
          0.1787,
          0.131
        ],
        "followup_median_s": 0.142,
        "followup_suffix_tps": 160.3
      },
      {
        "size": 16000,
        "prompt_tokens": 16286,
        "ttft_s": 38.3158,
        "tps": 425.0,
        "followup_s": [
          0.2027,
          0.1974,
          0.18
        ],
        "followup_median_s": 0.1974,
        "followup_suffix_tps": 116.6
      }
    ],
    "tool_calls": "pass",
    "peak_memory_gb": 20.32
  },
  "conditions": {
    "power_source": "battery",
    "power_mode": "low",
    "low_power_mode": true,
    "thermal_state": "nominal",
    "swapouts": 0,
    "gpu_quiet_wait_s": 301.7,
    "gpu_other_mean_pct": 71.24,
    "gpu_other_max_pct": 92.47,
    "gpu_ambient_mean_pct": 0.3,
    "gpu_users": [
      "com.miHoYo.GenshinImpact",
      "Google Chrome"
    ],
    "contention": [
      "decode",
      "decode_greedy",
      "prefill_4000",
      "prefill_16000",
      "tools"
    ]
  },
  "flags": [
    "CONTENTION: sustained foreign GPU load > 5% in ['decode', 'decode_greedy', 'prefill_4000', 'prefill_16000', 'tools'] (mean 71.24%, top ['com.miHoYo.GenshinImpact'])",
    "power: on battery (a Mac on battery may run slower)",
    "power: Low Power Mode (the GPU runs slower)"
  ],
  "invalid": []
}
