{
  "schema": 1,
  "kind": "kapitsa-bench",
  "mode": "full",
  "time_utc": "2026-10-22T23:43:53Z",
  "kapitsa": {
    "version": "0.2.9",
    "commit": "c490f81"
  },
  "mac": {
    "identifier": "Mac15,7",
    "name": "MacBook Pro (16-inch, Nov 2023)",
    "year": 2023,
    "chip": "Apple M3 Pro",
    "cpu_cores": 12,
    "gpu_cores": 18,
    "memory_gb": 36,
    "macos": "14.1",
    "macos_build": "23B2073"
  },
  "model": {
    "name": "nemotron-nano-9b-v2",
    "title": "Nemotron Nano 9B v2",
    "variant": "nvfp4",
    "precision": "NVFP4",
    "catalog": true,
    "revision": "8556c91",
    "decoding": "plain",
    "decoding_detail": "plain decoding",
    "drafter": null
  },
  "protocol": {
    "corpus_sha256": "58a7756fd94fc48a7b7306d330b2c44663bdf22faa943f82430966c2878081b2",
    "decode_tokens": 512,
    "decode_runs": 5,
    "greedy_runs": 5,
    "sizes": [
      4000,
      16000
    ],
    "temperature": 0.6
  },
  "results": {
    "decode": {
      "median_tps": 20.8,
      "runs_tps": [
        20.78,
        20.88,
        20.7,
        20.8,
        20.84
      ]
    },
    "decode_greedy": {
      "median_tps": 21.02,
      "runs_tps": [
        20.84,
        21.07,
        21.02,
        21.02,
        21.02
      ]
    },
    "prefill": [
      {
        "size": 4000,
        "prompt_tokens": 4184,
        "ttft_s": 12.6787,
        "tps": 330.0,
        "followup_s": [
          0.3353,
          0.3287,
          0.3221
        ],
        "followup_median_s": 0.3287
      },
      {
        "size": 16000,
        "prompt_tokens": 16516,
        "ttft_s": 52.3061,
        "tps": 315.8,
        "followup_s": [
          0.3587,
          0.3572,
          0.3627
        ],
        "followup_median_s": 0.3587
      }
    ],
    "tool_calls": "pass",
    "peak_memory_gb": 7.2
  },
  "conditions": {
    "power_source": "ac",
    "power_mode": "automatic",
    "low_power_mode": false,
    "thermal_state": "nominal",
    "swapouts": 0,
    "gpu_quiet_wait_s": 18.1,
    "gpu_other_mean_pct": 0.0,
    "gpu_other_max_pct": 0.0,
    "gpu_ambient_mean_pct": 0.0,
    "gpu_users": [],
    "contention": []
  },
  "flags": [],
  "invalid": []
}
