{
  "schema": 1,
  "kind": "kapitsa-bench",
  "mode": "full",
  "time_utc": "2026-10-30T22:44:07Z",
  "kapitsa": {
    "version": "0.2.25",
    "commit": "7ea4fff"
  },
  "mac": {
    "identifier": "MacBookPro18,2",
    "name": "MacBook Pro (16-inch, 2021)",
    "year": 2021,
    "chip": "Apple M1 Max",
    "cpu_cores": 10,
    "gpu_cores": 32,
    "memory_gb": 32,
    "macos": "27.2",
    "macos_build": "26B118"
  },
  "model": {
    "name": "qwen3.6-35b-a3b",
    "title": "Qwen3.6-35B-A3B",
    "variant": "4bit",
    "precision": "4-bit",
    "catalog": true,
    "revision": "9546051",
    "decoding": "KFlash",
    "decoding_detail": "KFlash speculative decoding (DFlash2 lattice, tree verify), KFlash (DFlash2)",
    "drafter": "incoai/Qwen3.6-35B-A3B-DFlash2@51ef7b6"
  },
  "protocol": {
    "corpus_sha256": "58a7756fd94fc48a7b7306d330b2c44663bdf22faa943f82430966c2878081b2",
    "decode_tokens": 512,
    "decode_runs": 5,
    "greedy_runs": 5,
    "sizes": [
      4000,
      16000
    ],
    "temperature": 0.6
  },
  "results": {
    "decode": {
      "median_tps": 141.49,
      "runs_tps": [
        138.06,
        141.49,
        139.89,
        148.34,
        153.12
      ]
    },
    "decode_greedy": {
      "median_tps": 162.1,
      "runs_tps": [
        164.69,
        159.9,
        165.98,
        162.1,
        148.53
      ]
    },
    "prefill": [
      {
        "size": 4000,
        "prompt_tokens": 4131,
        "ttft_s": 3.62,
        "tps": 1141.2,
        "followup_s": [
          0.0831,
          0.0952,
          0.0863
        ],
        "followup_median_s": 0.0863,
        "followup_suffix_tps": 264.7
      },
      {
        "size": 16000,
        "prompt_tokens": 16284,
        "ttft_s": 16.9346,
        "tps": 961.6,
        "followup_s": [
          0.0982,
          0.1133,
          0.0932
        ],
        "followup_median_s": 0.0982,
        "followup_suffix_tps": 224.0
      }
    ],
    "tool_calls": "pass",
    "peak_memory_gb": 21.39
  },
  "conditions": {
    "power_source": "ac",
    "power_mode": "high",
    "low_power_mode": false,
    "thermal_state": "fair",
    "swapouts": 0,
    "gpu_quiet_wait_s": 18.1,
    "gpu_other_mean_pct": 0.02,
    "gpu_other_max_pct": 0.55,
    "gpu_ambient_mean_pct": 0.45,
    "gpu_users": [],
    "contention": []
  },
  "flags": [],
  "invalid": []
}
