{
  "schema": 1,
  "kind": "kapitsa-bench",
  "mode": "full",
  "time_utc": "2026-10-22T06:23:22Z",
  "kapitsa": {
    "version": "0.2.6",
    "commit": "76a4970"
  },
  "mac": {
    "identifier": "MacBookPro18,3",
    "name": "MacBook Pro (14-inch, 2021)",
    "year": 2021,
    "chip": "Apple M1 Pro",
    "cpu_cores": 8,
    "gpu_cores": 14,
    "memory_gb": 16,
    "macos": "27.0.1",
    "macos_build": "26A434"
  },
  "model": {
    "name": "qwen3.6-35b-a3b",
    "title": "Qwen3.6-35B-A3B",
    "variant": "16gb",
    "precision": "2-bit experts",
    "catalog": true,
    "revision": "a483e9e",
    "decoding": "plain",
    "decoding_detail": "plain decoding",
    "drafter": null
  },
  "protocol": {
    "corpus_sha256": "1a9bb103b3f6d39ee5b9f5bf7207e304c5ce92788c273685f597508c7d2bde28",
    "decode_tokens": 512,
    "decode_runs": 5,
    "greedy_runs": 5,
    "sizes": [
      4000,
      16000
    ]
  },
  "results": {
    "decode": {
      "median_tps": 52.22,
      "runs_tps": [
        52.21,
        52.37,
        53.05,
        52.22,
        50.7
      ]
    },
    "decode_greedy": {
      "median_tps": 53.38,
      "runs_tps": [
        53.46,
        53.8,
        53.38,
        52.08,
        52.85
      ]
    },
    "prefill": [
      {
        "size": 4000,
        "prompt_tokens": 4133,
        "ttft_s": 8.9532,
        "tps": 461.6,
        "followup_s": [
          0.1611,
          0.2416,
          0.1501
        ],
        "followup_median_s": 0.1611
      },
      {
        "size": 16000,
        "prompt_tokens": 16286,
        "ttft_s": 40.189,
        "tps": 405.2,
        "followup_s": [
          0.2416,
          0.2267,
          0.1901
        ],
        "followup_median_s": 0.2267
      }
    ],
    "tool_calls": "pass",
    "peak_memory_gb": 11.25
  },
  "conditions": {
    "power_source": "ac",
    "power_mode": "automatic",
    "low_power_mode": false,
    "thermal_state": "nominal",
    "swapouts": 28572,
    "gpu_quiet_wait_s": 18.2,
    "gpu_other_mean_pct": 0.0,
    "gpu_other_max_pct": 0.0,
    "gpu_ambient_mean_pct": 0.0,
    "gpu_users": [],
    "contention": []
  },
  "flags": [
    "decode: 7908 pages swapped out during the phase",
    "decode_greedy: 2792 pages swapped out during the phase",
    "prefill_4000: 10680 pages swapped out during the phase",
    "prefill_16000: 7192 pages swapped out during the phase"
  ],
  "invalid": []
}
